<?xml version="1.0" encoding="UTF-8"?>
<package
        xmlns:xsi="http://www.w3.org/2001/XMLSchema-instance"
        xsi:noNamespaceSchemaLocation="https://apidocs.kajona.de/xsd/package_v2.xsd"
        >
    <title>tags</title>
    <description>Tags are used to connect objects with keywords.</description>
    <version>7.1</version>
    <author>Kajona Team</author>
    <providesInstaller>TRUE</providesInstaller>
    <requiredModules>
        <module name="system" version="7.1" />
    </requiredModules>
    <constants>
        <constant name="_tags_modul_id_" value="95" />
    </constants>
</package>