<?xml version="1.0" encoding="UTF-8"?>
<package
        xmlns:xsi="http://www.w3.org/2001/XMLSchema-instance"
        xsi:noNamespaceSchemaLocation="https://apidocs.kajona.de/xsd/package_v2.xsd"
        >
    <title>packagemanager</title>
    <description>The packagemanager wraps all logic to handle packages on the client side. The packagemanager handles the local update and installation of packages.</description>
    <version>7.1</version>
    <author>Kajona Team</author>
    <providesInstaller>TRUE</providesInstaller>
    <requiredModules>
        <module name="system" version="7.1" />
    </requiredModules>
    <constants>
        <constant name="_packagemanager_module_id_" value="2" />
    </constants>
</package>