<?xml version="1.0" encoding="UTF-8"?>
<package
        xmlns:xsi="http://www.w3.org/2001/XMLSchema-instance"
        xsi:noNamespaceSchemaLocation="https://apidocs.kajona.de/xsd/package_v2.xsd"
    >
    <title>dbrowser</title>
    <description>Visualizes the current database structure</description>
    <version>7.0</version>
    <author>Kajona Team</author>
    <providesInstaller>TRUE</providesInstaller>
    <requiredModules>
        <module name="system" version="7.0.1" />
    </requiredModules>
    <constants>
        <constant name="_dbbrowser_module_id_" value="20180808" />
    </constants>
</package>