<?xml version="1.0" encoding="UTF-8"?>
<package
        xmlns:xsi="http://www.w3.org/2001/XMLSchema-instance"
        xsi:noNamespaceSchemaLocation="https://apidocs.kajona.de/xsd/package_v2.xsd"
        >
    <title>system</title>
    <description>Core of the Kajona framework. By default, the system-packages includes several modules, e.g. system, permissions, user, messaging and languages.

When updating from 5.0 to 5.1 or performing another major update from x.x to x.y, make sure to use the upgrade script instead of the internal package management. See https://www.kajona.de/updateguide.html for details.

    </description>
    <version>7.1.1</version>
    <author>Kajona Team</author>
    <providesInstaller>TRUE</providesInstaller>
    <requiredModules />
    <constants>
        <constant name="_system_modul_id_" value="0" />
        <constant name="_user_modul_id_" value="15" />
        <constant name="_languages_modul_id_" value="65" />
        <constant name="_messaging_module_id_" value="135" />
    </constants>

</package>