<?xml version="1.0" encoding="UTF-8"?>
<package
        xmlns:xsi="http://www.w3.org/2001/XMLSchema-instance"
        xsi:noNamespaceSchemaLocation="https://apidocs.kajona.de/xsd/package_v2.xsd"
        >
    <title>search</title>
    <description>The module search provides a full-text search for both, backend and portal. It respects permissions and status of all records.</description>
    <version>7.1</version>
    <author>Kajona Team</author>
    <providesInstaller>TRUE</providesInstaller>
    <requiredModules>
        <module name="system" version="7.0" />
        <module name="packagemanager" version="7.0" />
    </requiredModules>
    <constants>
        <constant name="_search_module_id_" value="55" />
    </constants>
</package>