<?xml version="1.0" encoding="UTF-8"?>
<package
        xmlns:xsi="http://www.w3.org/2001/XMLSchema-instance"
        xsi:noNamespaceSchemaLocation="https://apidocs.kajona.de/xsd/package_v2.xsd"
    >
    <title>jqplot</title>
    <description>jqPlot charting engine. Used to render charts on the client-side, based on the common jqPlot library.</description>
    <version>7.1</version>
    <author>Kajona Team</author>
    <providesInstaller>FALSE</providesInstaller>
    <requiredModules>
        <module name="system" version="7.1" />
    </requiredModules>
    <constants />
</package>