<?xml version="1.0" encoding="UTF-8"?>
<package
        xmlns:xsi="http://www.w3.org/2001/XMLSchema-instance"
        xsi:noNamespaceSchemaLocation="https://apidocs.kajona.de/xsd/package_v2.xsd"
        >
    <title>fileindexer</title>
    <description>Tool to index file content.</description>
    <version>7.1</version>
    <author>Kajona Team</author>
    <providesInstaller>FALSE</providesInstaller>
    <requiredModules>
        <module name="mediamanager" version="7.1" />
        <module name="search" version="7.1" />
    </requiredModules>
    <constants>
        <constant name="_fileindexer_module_id_" value="1510915351" />
    </constants>

</package>