<?xml version="1.0" encoding="UTF-8"?>
<package
        xmlns:xsi="http://www.w3.org/2001/XMLSchema-instance"
        xsi:noNamespaceSchemaLocation="https://apidocs.kajona.de/xsd/package_v2.xsd"
        >
    <title>workflows</title>
    <description>A complex workflow-engine to trigger events by multiple triggers.</description>
    <version>7.1.1</version>
    <author>Kajona Team</author>
    <providesInstaller>TRUE</providesInstaller>
    <requiredModules>
        <module name="system" version="7.1" />
    </requiredModules>
    <constants>
        <constant name="_workflows_module_id_" value="115" />
    </constants>
</package>
