<?xml version="1.0" encoding="UTF-8"?>
<package
        xmlns:xsi="http://www.w3.org/2001/XMLSchema-instance"
        xsi:noNamespaceSchemaLocation="https://apidocs.kajona.de/xsd/package_v2.xsd"
>
    <title>tinyurl</title>
    <description>Create a shortened URL</description>
    <version>7.0</version>
    <author>Kajona Team</author>
    <type>MODULE</type>
    <providesInstaller>TRUE</providesInstaller>
    <requiredModules>
        <module name="system" version="7.0" />
    </requiredModules>
    <constants>
        <constant name="_tinyurl_module_id_" value="20180907" />
    </constants>
</package>