<?xml version="1.0" encoding="UTF-8"?>
<package
        xmlns:xsi="http://www.w3.org/2001/XMLSchema-instance"
        xsi:noNamespaceSchemaLocation="https://apidocs.kajona.de/xsd/package_v2.xsd"
>
    <title>_buildfilesNew</title>
    <description>Adds support for basic http authentication. Therefore an event-listener checks for authentication headers when processing the request and tries to login the user.</description>
    <version>7.1</version>
    <author>Kajona Team</author>
    <providesInstaller>FALSE</providesInstaller>
    <requiredModules>
        <module name="system" version="7.0" />
    </requiredModules>
    <constants></constants>
</package>