<?xml version="1.0" encoding="UTF-8"?>
<package
        xmlns:xsi="http://www.w3.org/2001/XMLSchema-instance"
        xsi:noNamespaceSchemaLocation="https://apidocs.kajona.de/xsd/package_v2.xsd"
    >
    <title>ezcchart</title>
    <description>ezComponents charting engine. Used to render charts on the server-side, generating an image. Makes use of the ezComponents library.</description>
    <version>7.1</version>
    <author>Kajona Team</author>
    <providesInstaller>FALSE</providesInstaller>
    <requiredModules>
        <module name="system" version="7.1" />
    </requiredModules>
    <constants />
</package>