<?xml version="1.0" encoding="UTF-8"?>
<package
        xmlns:xsi="http://www.w3.org/2001/XMLSchema-instance"
        xsi:noNamespaceSchemaLocation="https://apidocs.kajona.de/xsd/package_v2.xsd"
        >
    <title>mediamanager</title>
    <description>
        The mediamanager is a central place to handle all kind of files. This includes images for galleries or even a download-manager.
        If you have the package "qr-code" installed, the download links may be illustrated using a qrcode-image, too.
        The mediamanager replaces the old (v3) download- and gallery-modules.
    </description>
    <version>7.0</version>
    <author>Kajona Team</author>
    <type>MODULE</type>
    <providesInstaller>TRUE</providesInstaller>
    <requiredModules>
        <module name="system" version="7.0" />
    </requiredModules>
    <constants>
        <constant name="_mediamanager_module_id_" value="130" />
        <constant name="_mediamanager_folderview_modul_id_" value="13" />
    </constants>
</package>